id,comentario,toxicidad,constructividad
298,"Qué forma más horrorosa de morir. Apaleada (por el hombre al que había, probablemente, amado). Pensadlo un momento; ni un animal se merece una muerte así. Cuánto tiempo tardará en salir ese monstruo de la cárcel? 4,5 años? O cambiamos el sistema: leyes, penas, etc..o esto irá a peor. Qué justicia más injusta tenemos en España.",2. Ligeramente tóxico,no
2792,"Falta por poner como turistas a los que vengan de Corea del Norte, que como en China tiene menos contagios y muertos que Europa. Gilipolleces de los europeos, lo que tendrían que haber hecho es aprovechar este tiempos para montar empresas que hagan test rápidos y fiables, a millones para abaratar el coste de estos test y obligar a los viajeros a hacerse un test en origen, y aunque tarden un tiempo en tener resultados de los test, tiene el tiempo del viaje hasta que aterrice en Europa y tomar decisiones si dentro del avión ha dado alguno positivo",2. Ligeramente tóxico,sí
139,"No sé González pero Rajoy tras un primer mandato malo a pesar de su mayoría absoluta y su nefasto segundo mandato en minoría, siendo el único caso de un Presidente echado tras una moción de censura ¿No sería mejor que estuviera calladito?",2. Ligeramente tóxico,sí
535,@berberecho #195 que no fue sado porque salió volando,1. No tóxico,no
945,"#5: Da igual que se hable del master de cifuentes, de comisiones, o de cualquier otro chanchullo monumental en el gobierno.. nunca pasa nada.. nadie tiene ninguna responsabilidad politica por sus actos.. Y cuando llegan las elecciones sus sabios votantes deciden para ir a peor mejor seguir con los corruptos de toda la vida.. Y ahi sigue españa y los españoles.. viendo la mafia pasar.. digo la vida!",2. Ligeramente tóxico,no
2087,PP=VOX,3. Tóxico,no
1771,@kubmarcos #16 en una de esas la confecciona tezanos,1. No tóxico,no
2467,Ni aún así cumplirá lo prometido. Otra más... Mentirusca gorda.,2. Ligeramente tóxico,no
2280,Esto se esperaba. El rodillo funciona y funcionará. La solución es no utilizar los pinganillos los del PP,2. Ligeramente tóxico,sí
727,"Evidentemente, dejar la economía y los sectores productivos en manos bolcheviques, sólo llevan a la miseria y dictadura",3. Tóxico,no
1978,La estupidez consiste en repetir una y otra vez el mismo error esperando cada vez un resultado distinto.,2. Ligeramente tóxico,no
2322,"Y gracias a que Pedro Sánchez ya tiene aprobado el techo de gastos para los presupuestos, que sino le hubiera tocado ir también a Perpiñán acompañado por sus 21 ministros a dorarle la píldora.",2. Ligeramente tóxico,sí
1621,"Fuerza, mucha fuerza, Dani, eres un superheroe y sin dudas un gran heroe de los animales. Ellos te necesitan muchisimo!",1. No tóxico,no
63,"Hay otras omisiones más flagrantes. La más grave, quizás, es la falta de reconocimiento de que la existencia misma de la UE fue posible gracias a las campañas militares tanto del Ejército Rojo como de otros grupos afiliados al comunismo. Los nazis no fueron derrotados por una lista de demócratas benévolos y de mentalidad liberal, como lo han presentado algunas películas nostálgicas, como la reciente Dunkerque de Christopher Nolan. La victoria, como la mayoría de los europeos aprenden en la escuela, fue gracias al Acuerdo de Yalta, que vio una alianza renuente no entre los soviéticos y los nazis, sino entre los soviéticos, los británicos y los estadounidenses. Los yanquis y los tommies desempeñaron su papel, sí, pero también lo hicieron los millones de soldados rusos que murieron en el frente oriental, sin mencionar los movimientos partisanos italianos, franceses y otros, la mayoría de los cuales estaban motivados por alguna visión del comunismo.",1. No tóxico,sí
900,Lo q tu ves. Yo veo que jugar la copa del Rey y la Liga española. España 5...España 0,1. No tóxico,no
463,"Es peligrosísimo tener a un enano mental dirigiendo una potencia mundial. ¿Es que no hay gente normal en EEUU? Este tío estaba pagándole a la actriz porno 130.000 $ para cerrarle la boca y la orden siguiente fué ""atacar a Siria"" Estamos listos con esta tropa. Que Dios nos coja confesados.",3. Tóxico,no
1732,"¡Falabarato! Preciosa expresión, de una sonoridad más que acogedora. A ver si encuentro un sinónimo en panocho... 👍",2. Ligeramente tóxico,no
1506,@Markad #511 ¿Es racismo repetir bulos como estos una y otra vez? A ver si nos enteramos que ni los unos son tan buenos ni los otros son tan malos y viceversa! Que todos somos las dos caras de la misma moneda! Y que los odios cruzados es lo que está aniquilando nuestra sociedad!,2. Ligeramente tóxico,sí
1093,@Orry #7 Hay que saber perder... Se pasa antes la pena.,1. No tóxico,no
1910,Peyró se te han olvidado los muertos del 11M,2. Ligeramente tóxico,sí
2632,Dejando a un lado las ideologías es que estamos gobernados por políticos cada día más inútiles. Es que no saben ni trincar. Esta señora ha utilizado el viejo truco de trocear contratos.,2. Ligeramente tóxico,no
1431,"#63DE RARO NADA.. Según lo que ha dicho Errejón, saben que la izquierda y Podemos no van conquistar el poder por la mejora de la economía lo que vienen a decir que cuando peor nos vaya a los españoles mejor para ellos. Por lo que tienen que calentar la calle, internet y las redes sociales para asaltar el poder ya sea por lo de la manada o por lo del master de Cifuentes, tal y como hicieron con el 11M con el ""¿quién a sido?"".",2. Ligeramente tóxico,sí
756,"@Jarras Y tú deberías ir al proctólogo a que mire tus problemas con los condilomas perianales. A pastar, nene",3. Tóxico,no
1436,que se pongan a trabajar como el resto? o que se pongan a mangar?como el resto,2. Ligeramente tóxico,no
1786,@santoypaciente 295. Gracias,1. No tóxico,no
270,"Se agradecería algo de periodismo serio y de investigación, porque no es casualidad que en los últimos decenios nos regalen estas epidemias sin precedentes de virus ""extraños"". Por ejemplo, habría que saber qué piensan del desarrollo de la genética artificial que ha permitido ""resucitar"" virus como el de la mal llamada gripe ""española"", y los experimentos que han añadido inserciones de proteínas VIH y m.tuberculosis en dicho virus, con consecuencias impredecibles. Para los escépticos, si leen inglés, vean esta publicación sobre los virus sintéticos: http://cort.as/-VCi3",3. Tóxico,no
926,Artículos para fomentar la ignorancia jajaja.,2. Ligeramente tóxico,no
2459,Y todo por una p....,3. Tóxico,no
2673,Aguado traidor vete a tu casa.,3. Tóxico,no
2894,"Que vergüenza de gobierno tenemos en España. Es lamentable, P Sanchez vive en otra galaxia...",3. Tóxico,no
2597,@Edgar16 #3 está señora solo pasaba por allí. Todo el mérito es de Ayuso y de Fracasado. Típico de peperos.,3. Tóxico,no
178,"Si este hombre delató a criminales que roban y evaden a Suiza, no debe ser encarcelado, sino ponerle una medalla.",1. No tóxico,sí
192,"El Gutiérrez sabe mucho de cuentas de cuando estuvo en la diputación, compraba al por mayor",2. Ligeramente tóxico,no
2107,"MENTIRA. En el ""Panhandle"" de la Florida nieva de vez en cuando. Yo he visto la nieve en Pensacola. Además, Trump cambió su residencia de New York a la Florida por encontrar en Palm Beach  mejor acogida  que la del alcalde comunista y los sectarios de la ciudad de New York, que  gastan un dineral para pintar un letrero enorme de ""black lives matter "" en el pavimento de la calle frente a la torre Trump, que ya varias veces han tenido que repintar porque los ciudadanos lo embarran continuamente con pintura. Anoche le volvieron a dejar de lo más guapo el letrero al sectario alcalde.https://www.thesun.co.uk/news/13021618/black-lives-matter-mural-trump-tower-defaced-with-tar/",3. Tóxico,sí
1157,"Felipe, habla con el indecente de M.rajoy. Si no te suena, examina los papales de bárcenas y veras como aparece allí, está reflejado en dichos papeles cobrando en B sobre sueldos, sí, el de Moncloa y le dices, que convoque un referéndum para que el pueblo de España, decida, si Monarquía o República. Que conste, que prefiero Monarquía, pero la reformaría de ¡cabo a rabo!",2. Ligeramente tóxico,sí
2602,vicepresidenta de igualdad y protección de menotes. esta basura es lo que tenemos en Valencia. estamos disfrutando de lo votado.. por otros,3. Tóxico,no
1381,"Muy simple. Si en efecto los objetivos del bombardeo hubieran sido centros de producción y depósitos de armas químicas... ¡hubieran muerto miles de personas! Pues las sustancias, sobre todo gases, se hubieran esparcido tras el bombardeo. Los misiles no tienen la capacidad de absorber los gases cuando estallan -es absurdo pensarlo-. Con ese hecho se prueba claramente que el ataque, sus objetivos y sus resultados, fueron una total y absoluta mentira.",2. Ligeramente tóxico,sí
457,#48Porque estaba representando a un equipo de la Premier. Si va al campo como un aficionado más con el lacito dichoso no pasaría nada.,1. No tóxico,no
1106,...es que no hace falta. Para lo que representa el PP en el rubro honestidad y legalidad.....puede quedarse perfectamente.,1. No tóxico,no
1090,"#147te equivocas, Freistaats son solamente Freistaat Bayern (1945), Freistaat Sachsen (1990) y Freistaat Thüringen (1993), nada mas...",1. No tóxico,no
2240,"Pero que gente mas plasta, aburren ya de tanta tonta",3. Tóxico,no
331,"@yespudin #30 Tengo una botellita en casa y la tengo en la mano. Dice: Composición para 100 gramos: Etanol.. 48,5 grs; Propan-2-ol.. 26 grs; Clorhidrato de Biguanida Polimérica.. 0,04 grs. Agua y excipientes c.s.p. 100 grs. Y asegura cumplir con las normas europeas UNE-prEN 12054, UNE-EN 1500, 12791, 1650, 14476 y 14348. Asegura ser ""antiséptico para el personal de todos los ámbitos, incluidos sanitario e industria alimentaria"". De hecho, a mí me lo recomendó un consejero-delegado de una de las mayores aseguradoras sanitarias de España. Y, como digo, nos ha ido muy bien, y no tiene un precio desorbitado. Gracias por sus respuestas.",1. No tóxico,sí
1187,Reino Unido Francia Italia España EeUu tienen armas atómicas q serían inmediatamente dirigidas a Rusia en caso de ataque,1. No tóxico,sí
1239,"Para ota cosa no, pero para criticar, sembrar la duda, despresrigiar cualquier avance, para eso SI, tenemos el record guiness. Que mania!!!! si por nosotros fuera aun estariamos subidos en los arboles.",2. Ligeramente tóxico,no
679,"@Trainspotting #66 Me considero pro-vacunas pero en esto discrepo absolutamente con usted. Son mis hijos, no ""nuestros niños"". La vacunación contra el sars-covid-2 es para ""suavizar"" la infección en personas de edad donde en un posible contagio puede llevar a complicaciones graves. La vacunación en preadolescentes y adolescentes de entre 12 a 15 años carece de urgencia sanitaria. Es más, son edades de máximo desarrollo hormonal. ¿Puede ser más claro? por favor.",1. No tóxico,sí
51,#111ya ya...super liberales....pero de amarillo no. Meseta en estado puro.,2. Ligeramente tóxico,no
1938,¡ Qué pedazo de deportista !,1. No tóxico,no
842,"Un país moderno no puede tener un rey o dos con su entorno corrupto y que es típico del medievo y además tres millones y medio de parados .... donde está la modernidad de este país saqueado , quien la ve ?",2. Ligeramente tóxico,no
44,"Esto se prefijo hace tiempo. Que en cuanto llegara el PSOE al poder estos delincuentes iban a estar en la calle y les iba dar todo lo k no da al resto de España. Y sabeis a quien NO votar para las proximas elecciones. Gallegos y extremeños hasta los wevos del PSOE, por k reaparte a su gusto y no a los españoles.",3. Tóxico,no
805,"Lo de Podemos es todo folletín de dictachuelos como el Koletas y traidores como el Errejon aliñada con corruptelas de Espinar. Podemos, tic tac ....... tic tac",2. Ligeramente tóxico,no
1556,Pipí,1. No tóxico,no
839,#120jajajaja MENTIROSO COSLADA CALLE MÉJICO http://coslada.callejero.net/calle-de-mejico.html EN CORDOBA Y LAS DEMÁS QUE HAS PUESTO MENTIROSO,2. Ligeramente tóxico,no
1977,Bueno en la Galicia pepera ocurre lo mismo,2. Ligeramente tóxico,sí
1322,"No lo pueden extraditar . Ya una vez ganó en los tribunales su derecho a no ser extraditado, y ahora, aunque Suiza quiera, ocurrirá lo mismo . Se va a quedar, afortunadamente. Confío sin duda alguna en nuestros jueces, y no hay desde el punto de vista legal motivos para echarlo. Ha COLABORADO con el estado español ayudando a sacar a la luz solamente en España 300 millones de euros que recaudó hacienda. El delito que se le acusa en Suiza, no sería delito aquí. Si aquí un banquero entrega una lista de personas con dinero oculto al estado, no sería delito. Y de hecho, Suiza modificó después del caso falquiani sus leyes, y ahora cuando un extranjero abre una cuenta en Suiza se informa a la hacienda de su país de origen. Por tanto lo que hizo falquiani ya no sería ni delito. Otra cosa es que los poderosos le tengan ganas a falquiani y aún en Suiza le persigan, pero confío en nuestros jueces, no entregarán a una persona con ética y que hizo lo correcto, dar los defraudadores a conocer.",1. No tóxico,sí
2914,"Y aquel quien calla ante el Honor, delinque, Sumar, Direcciones Generales, Subdirecciones Generales, Secretarías Generales Técnicas, Sub Secretarias Generales Técnicas, Ministros, Presidentes, Secretarios y vice Secretarios, porque el Dinero es la Manecilla que da cuerda al pájaro que mueve el Mundo.",2. Ligeramente tóxico,no
188,"#91Podemos y PSOE están sin votos para las siguientes elecciones, no se haga ilusiones. Aunque pongan al mismísimo Hugo Chavez no van a sacar ni para pipas.",2. Ligeramente tóxico,no
246,Le digo más. ¿Y a mi que c..ñ.. me importa lo que critique usted a ese señor? Ni le he votado ni me gobierna. En cambio me preocupa bastante más el comportamiento de los que si gobiernan(por decir algo) ya que sufriré las consecuencias.,3. Tóxico,no
2896,@KurtGodel #467 NO EXISTE NINGUNA INVASIÓN MIGRATORIA.,2. Ligeramente tóxico,no
1832,@ATM_1965 #252 Tú pm,3. Tóxico,no
2289,"@RM777 #325 No, cada uno que se sienta lo que le de la gana. Total todos tenemos DNIs, lo tiene ya hasta ""Vinisius"". XD",3. Tóxico,no
2009,JAJAAJAJAAJAJAJAJAJAJAJAJAJAAJAJAJAAAJAJAJ   Me parto¡¡¡¡¡¡¡¡¡¡¡¡¡¡¡¡¡¡¡¡¡¡¡¡¡¡¡¡¡   Y te crees lo que escribes?????,2. Ligeramente tóxico,no
1706,"otros la llamarían ""nazi""",2. Ligeramente tóxico,no
1702,¿Las elecciones no las había ganado el candidato Casadete del Partido Populista?,3. Tóxico,no
1288,"#54Símbolos declarados ilegales por motivos obvios, aquí en España tenemos una asociación ensalzando la figura equivalente a Hitler totalmente legal y hasta hace poco subvencionada con dinero público. Que yo sepa una camiseta amarilla no es ilegal, al menos de momento.",2. Ligeramente tóxico,sí
102,"#623Y la irresponsabilidad del psoe, dando llave de gobierno a los nacionalistas, menos. En vez de negociar mejoras sociales a escala nacional, deja que se pierda dinero en esos chantajistas locales.",2. Ligeramente tóxico,sí
1023,"Ya en el titular hay dos mentiras. La 3ª quizás sea cierta y no dimita, pero la pueden ""dimitir"" otros.",1. No tóxico,no
416,"#61Ay como aburres, con una orden de alejamiento y que a menos de 1km le de una descarga al agresor. yo no voy a agredir a nadie, ni reflexionar sobre algo que tiene tanta lógica y ayudaría a que no hubiese mas asesinatos. normal que te llames ""yoquese"", hay que dárltelo todo masticadito... si la descarga lo mata ya harán un articulo en este periódico, donde podrás comentar y dar tu opinion.",2. Ligeramente tóxico,no
1005,#191universidad pública...,1. No tóxico,no
2462,Éste tío se piensa que somos todos socialistas.,2. Ligeramente tóxico,no
1502,"Lo que pasa es que sobran los que no quieren estar en España, puerta, y a quien le pique que se rasque",2. Ligeramente tóxico,no
2708,Papa Estado siempre gana,2. Ligeramente tóxico,no
2706,"Como siempre los fachis dando la nota, el mandapelotas es el tipico fascista de libro, un perdedor amargado, su inteligencia es comparable a la de una ameba, te dire que los de bilbao somo seuropeos, te gusta mas eso?, anda fachin",3. Tóxico,no
557,"Este tipo, que siempre va dando lecciones al mundo con su apariencia de buenecito, es uno de los mayores inversores en empresas de inteligencia artificial y de  otros muchos negocios 'grises'.",2. Ligeramente tóxico,sí
544,"Falciani ha colaborado con el estado español en descubrir corrupción y blanqueamiento de capitales ... y ahí es donde le duele a Suiza , pais hucha de los capitales de origen incierto e ilegales ... incluido las cuentas B de PP . Legalidad 1 - Suiza y corrupción 0",2. Ligeramente tóxico,no
2835,De dónde han sacado la pasta para pagar 600 buses?Torra lo sabe.,2. Ligeramente tóxico,no
506,"@11122 #7 Lo que está claro es que tú ni eres, ni vives en Galicia. De lo contrario jamás dirías que el castellano está a punto de desaparecer aquí. Dejad de molestar anda...",2. Ligeramente tóxico,sí
2650,Jajajaja fortuito dice el caradura,2. Ligeramente tóxico,no
291,"@Abueloladilla #11 Lee la entrevista al presidente del colegio de médicos de hoy en este diario. Dice que el tema de Madrid es un tema político entre PP y PSOE. A partir de ahí, lo demás no vale",1. No tóxico,sí
1442,"Si los suizos quieren negociar, les propongo un 3x1: Rovira, Gabriel y el dineral robado por los Pujol por el Falciani. ¿Hay trato?",1. No tóxico,no
2866,"Voxonianos y Peperos: teneis una empanada mental que no hay cristo que os entienda. La Constitución se fundamenta en la indisoluble unidad de la Nación española, patria común e indivisible de todos los españoles, y reconoce y garantiza el derecho a la autonomía de las nacionalidades y regiones que la integran. El independentismo solicita un referendum sobre la independencia, contrario a la constitución. Vosotros solicitais la supresión de las autonomías que parte de la declaración del artículo 2, el mismo que recoge la indisoluble unidad de la Nación, por lo tanto, contrario al ordenamiento jurídico. Las dos propuestas necesitan la modificación de la consititución. Según el Tribunal Constitucional (SSTC 48/2003, FJ 7 y 103/2008, FJ 2), la Constitución Española puede ser modificada sin ningún límite, esto es, sin que existan clausulas de intangibilidad explícitas o implícitas, siempre y cuando se respete el procedimiento legal establecido.",3. Tóxico,sí
194,#513No. El bbva tiene su sede en Madrid. Apuesto que tampoco sabes por qué...,1. No tóxico,no
650,"Señalar sólo una puntualización a la que no se ha referido Manuel Jabois en su artículo: además del ""chiste"" que ha provocado la destitución de esta señora comisaria de la Policía Nacional (y que no ha supuesto ninguna consecuencia para todos aquellos que, satisfechos, le rieron la gracia), en el mismo banquete de homenaje a un compañero (pagado con nuestros impuestos, que nadie se olvide) la susodicha también se refirió a su destino anterior en la Comisaría de Pozuelo de Alarcón mostrando su satisfacción al referirse a esta ciudad madrileña como ""Plaza Nacional"" y no ""Republicana"".",1. No tóxico,sí
1228,"FALCIANI LIBERTAD, YA!!!",1. No tóxico,no
1964,JAJAAJAJAJAJAJAAJJAJAJAAJAJAJ  Y en 2018??????????????????  JAJAJAJAJAJAJAJAJAJAAJAJJAAJAJAJAJ,2. Ligeramente tóxico,no
486,La llamaban eso por la cantidad de asesinados por los rojos que tuvo.,1. No tóxico,sí
2689,Dios los cría y ellos se juntan.,1. No tóxico,no
52,"#14Las ""feministas"" (como usted dice) no hacemos estadísticas por nacionalidad. Son algunos de ustedes los que sí las hacen, y a mí me parece un ejercicio muy sospechoso...",1. No tóxico,no
144,Aqui no hay dimisión inmediata ¡¡¡¡¡¡¡¡. Aqui no hay culpables ¡¡¡¡¡¡ Aqui hay la ley del silencio¡¡¡¡¡¡. Pero no les servirá de nada a estos de extrema izquierda. CARADURAS,3. Tóxico,no
2506,"Diario Expansion 9/07/2019.-"" Gracias al crecimiento económico, el pueblo español en 1975 tenía niveles de vida y fe en el futuro como nunca tuvo en tiempos de la República. Por eso resultó relativamente fácil la Transición. También a veces los economistas aciertan, y merecen un reconocimiento.""",1. No tóxico,sí
2757,"Otra buena película de este año: ""El sastre de la mafia"".",1. No tóxico,no
2337,"Es que como ya demostró hace mucho Tamara-Ámbar-Yurena, una cosa es vender discos y otra que no se rían de ti.",1. No tóxico,sí
449,"#146patriota es Bibiana Aído, con menos currículum que Tarzan, y ahí la tienes, enchufada por ZP en la ONU ganando 10.000 dólares al mes, payaso.",3. Tóxico,no
322,"el cambio prometido, Falciani por Marta, ya no existe,",1. No tóxico,no
1814,@gh10443 #713 Sólo tiro ketchup,1. No tóxico,no
2123,Comunista Dior y Cartier. Pero pagando los contribuyentes.,3. Tóxico,no
554,"#106Yo pensé exactamente lo mismo.Ni una opinión ni remotamente discrepante.Adoctrinamiento puro.Y así en casi todos los medios de comunicación y en la enseñanza,al menos en la pública.Una labor de ingeniería social propia de un régimen totalitario.Las nuevas generaciones repitiendo como robots los tópicos y falsedades del feminismo actual.Por eso me siento bastante pesimista sobre el futuro que nos espera.Qué tristeza!",2. Ligeramente tóxico,no
785,"#78Lamento muchísimo su situación. Soy mujer y me avergüenzan casos como el suyo. Comprendo que haya pensado en suicidarse, si me pasase a mí, también lo habría pensado. Cuando te despojan de todo, de todo lo material, de lo que más quieres, de tu dignidad y, además, sólo te queda el silencio administrativo, verdaderamente te lo roban todo. Ojalá ningún hombre se suicide por este asco de ley anticonstitucional. Y ojalá hubiera más dinero para poder asociarse, hacer más ruido, hacerse oír. Yo os apoyo a todos y podéis contar conmigo para defender lo justo.",2. Ligeramente tóxico,sí
174,#172Ah! Es coña.,1. No tóxico,no
2822,"Ah, ¿El milagro de IFEMA se debe a la sra Ayuso? No me diga...",2. Ligeramente tóxico,no
1195,"#297Solución, vete. Adiós.",2. Ligeramente tóxico,no